{
  "$schema": "http://json-schema.org/draft-07/schema#",
  "title": "Vendor Record Structure",
  "description": "Data elements based on Treasury Board of Canada's Standard on Vendor Record",
  "type": "object",
  "required": [
    "legalName",
    "countryCode",
    "vendorIdentificationNumbers",
    "organizationType"
  ],
  "properties": {
    "legalName": {
      "description": "Legal name of the vendor",
      "type": "string",
      "maxLength": 120
    },
    "operatingName": {
      "description": "Operating name if different from legal name",
      "type": "string",
      "maxLength": 120
    },
    "countryCode": {
      "description": "Country code (ISO 3166-1 alpha-2)",
      "type": "string",
      "pattern": "^[A-Z]{2}$"
    },
    "vendorIdentificationNumbers": {
      "type": "object",
      "description": "Collection of identification numbers",
      "properties": {
        "businessNumber": {
          "description": "Business Number (BN) assigned by CRA - 9 digits for base BN, 15 chars for program account (9 digits + 2 letters + 4 digits)",
          "type": "string",
          "pattern": "^[0-9]{9}([A-Z]{2}[0-9]{4})?$"
        },
        "supplierNumber": {
          "description": "Supplier identification number",
          "type": "string"
        },
        "gstHstNumber": {
          "description": "GST/HST Registration Number",
          "type": "string",
          "pattern": "^[0-9]{9}RT[0-9]{4}$"
        },
        "dunsNumber": {
          "description": "D-U-N-S Number",
          "type": "string",
          "pattern": "^[0-9]{9}$"
        },
        "qstNumber": {
          "description": "Quebec Sales Tax Number",
          "type": "string",
          "pattern": "^[0-9]{10}TQ[0-9]{4}$"
        },
        "sinNumber": {
          "description": "Social Insurance Number (SIN) - Only for individuals",
          "type": "string",
          "pattern": "^[0-9]{9}$"
        }
      }
    },
    "contactInformation": {
      "type": "object",
      "properties": {
        "address": {
          "type": "object",
          "properties": {
            "streetAddress": {
              "type": "string",
              "maxLength": 100
            },
            "city": {
              "type": "string",
              "maxLength": 50
            },
            "province": {
              "type": "string",
              "maxLength": 50
            },
            "postalCode": {
              "type": "string",
              "maxLength": 10
            }
          },
          "required": [
            "streetAddress",
            "city",
            "postalCode"
          ]
        },
        "telephone": {
          "type": "string",
          "pattern": "^[0-9]{10,15}$"
        },
        "email": {
          "type": "string",
          "format": "email"
        }
      }
    },
    "organizationType": {
      "description": "Vendor Category",
      "type": "string",
      "enum": [
        "Individual",
        "Business",
        "Government",
        "NGO",
        "Other"
      ]
    },
    "size": {
      "description": "Size of the organization",
      "type": "string",
      "enum": [
        "Small",
        "Medium",
        "Large"
      ]
    },
    "aboriginalStatus": {
      "description": "Aboriginal status indicator",
      "type": "boolean"
    },
    "minorityStatus": {
      "description": "Visible minority indicator",
      "type": "boolean"
    },
    "womenOwnedStatus": {
      "description": "Women-owned business indicator",
      "type": "boolean"
    },
    "bankingInformation": {
      "type": "object",
      "properties": {
        "accountHolderName": {
          "type": "string"
        },
        "bankIdentifier": {
          "type": "string",
          "pattern": "^[0-9]{3}$"
        },
        "branchIdentifier": {
          "type": "string",
          "pattern": "^[0-9]{5}$"
        },
        "accountNumber": {
          "type": "string",
          "pattern": "^[0-9]{7,12}$"
        }
      },
      "required": [
        "accountHolderName",
        "bankIdentifier",
        "branchIdentifier",
        "accountNumber"
      ]
    },
    "commodityCodes": {
      "description": "UNSPSC commodity codes",
      "type": "array",
      "items": {
        "type": "string",
        "pattern": "^[0-9]{8}$"
      }
    }
  },
  "allOf": [
    {
      "if": {
        "properties": {
          "organizationType": { "enum": ["Individual"] }
        }
      },
      "then": {
        "properties": {
          "vendorIdentificationNumbers": {
            "required": ["sinNumber"]
          }
        }
      }
    },
    {
      "if": {
        "properties": {
          "organizationType": { "enum": ["Business"] },
          "countryCode": { "enum": ["CA"] }
        }
      },
      "then": {
        "properties": {
          "vendorIdentificationNumbers": {
            "required": ["businessNumber"]
          }
        }
      }
    },
    {
      "if": {
        "properties": {
          "countryCode": { "enum": ["CA"] }
        }
      },
      "then": {
        "properties": {
          "contactInformation": {
            "properties": {
              "address": {
                "properties": {
                  "postalCode": {
                    "pattern": "^[A-Z][0-9][A-Z]\\s?[0-9][A-Z][0-9]$"
                  }
                }
              }
            }
          }
        }
      }
    },
    {
      "if": {
        "properties": {
          "countryCode": { "enum": ["US"] }
        }
      },
      "then": {
        "properties": {
          "contactInformation": {
            "properties": {
              "address": {
                "properties": {
                  "postalCode": {
                    "pattern": "^[0-9]{5}(-[0-9]{4})?$"
                  }
                }
              }
            }
          }
        }
      }
    }
  ]
}