{
  "legalName": "Department of Innovation",
  "operatingName": "DOI",
  "countryCode": "CA",
  "organizationType": "Government",
  "vendorIdentificationNumbers": {
    "businessNumber": "987654321",
    "supplierNumber": "GOV-54321"
  },
  "contactInformation": {
    "address": {
      "streetAddress": "789 Government Road",
      "city": "Ottawa",
      "province": "Ontario",
      "postalCode": "K1P5M7"
    },
    "telephone": "6135557890",
    "email": "contact@doi.gc.ca"
  }
}